{
  "data_contract": {
    "candidates_sha256": "754551dd47950ff4b919d03244338110e22ca8740713c8074cbce08c90b6d36b",
    "kind": "formal_data_csv",
    "observations_sha256": "ad2e0bb990d1a5fc3d7c726105bbba471d1048bc9ab07b4a64613afa63512819",
    "path": "data.csv",
    "review_decisions_sha256": "c1c7fc7d32b67809b202ec79e4fa65e7b92e4dc56a5989f67f7b9b9180e5286c",
    "row_count": 100,
    "sha256": "39f5a5af067ddc2ce53cd62815a6257f3d05c41ec670a2bdda4e840c7f193e07",
    "source_sha256": "1bc8dccaf6b89e90aa75c81ef577962877e7c404439a70aee4f5465e46ebd059",
    "spec_sha256": "754fb6ddb0451047eb8a0d60b4e03d876bf64c6e889684cced3c06038051385f",
    "style_independent": true
  },
  "figure": {
    "background": "white",
    "crop_mode": "fixed_canvas",
    "dpi": 300,
    "size_mm": [
      110,
      72
    ]
  },
  "panels": [
    {
      "annotations": [],
      "axes": {
        "x": {
          "limits": [
            -3.552713678800501e-15,
            12.000000000000004
          ],
          "scale": "linear"
        },
        "y": {
          "limits": [
            -0.049999999999998046,
            4.95
          ],
          "scale": "linear"
        }
      },
      "bbox_normalized": [
        0.16,
        0.16,
        0.78,
        0.74
      ],
      "id": "digitized_panel",
      "plots": [
        {
          "data": {
            "x": [
              -3.552713678800501e-15,
              0.09999999999999654,
              0.19999999999999662,
              0.2999999999999967,
              0.3999999999999968,
              0.4999999999999969,
              0.599999999999997,
              0.6999999999999966,
              0.7999999999999967,
              0.8999999999999968,
              0.9999999999999969,
              1.099999999999997,
              1.199999999999997,
              1.2999999999999972,
              1.3999999999999972,
              1.4999999999999973,
              1.5999999999999974,
              1.6999999999999975,
              1.7999999999999972,
              1.8999999999999972,
              1.9999999999999973,
              2.099999999999998,
              2.1999999999999975,
              2.299999999999997,
              2.3999999999999977,
              2.4999999999999973,
              2.599999999999998,
              2.6999999999999975,
              2.799999999999998,
              2.8999999999999977,
              2.9999999999999982,
              3.099999999999998,
              3.1999999999999984,
              3.299999999999998,
              3.3999999999999977,
              3.4999999999999982,
              3.599999999999998,
              3.6999999999999984,
              3.799999999999998,
              3.8999999999999986,
              3.9999999999999982,
              4.099999999999999,
              4.199999999999998,
              4.299999999999999,
              4.399999999999999,
              4.499999999999998,
              4.599999999999999,
              4.699999999999998,
              4.799999999999999,
              4.899999999999999,
              7.1000000000000005,
              7.2,
              7.3,
              7.3999999999999995,
              7.500000000000001,
              7.6000000000000005,
              7.7,
              7.8,
              7.8999999999999995,
              8.0,
              8.100000000000001,
              8.2,
              8.3,
              8.400000000000002,
              8.5,
              8.600000000000001,
              8.7,
              8.8,
              8.900000000000002,
              9.0,
              9.100000000000001,
              9.2,
              9.3,
              9.400000000000002,
              9.5,
              9.600000000000001,
              9.700000000000003,
              9.8,
              9.900000000000002,
              10.0,
              10.100000000000001,
              10.200000000000003,
              10.3,
              10.400000000000002,
              10.5,
              10.600000000000001,
              10.700000000000003,
              10.8,
              10.900000000000002,
              11.0,
              11.100000000000001,
              11.200000000000003,
              11.3,
              11.400000000000002,
              11.500000000000004,
              11.600000000000001,
              11.700000000000003,
              11.8,
              11.900000000000002,
              12.000000000000004
            ],
            "y": [
              -0.049999999999998046,
              -0.049999999999998046,
              0.0500000000000016,
              0.0500000000000016,
              0.15000000000000213,
              0.15000000000000213,
              0.2500000000000018,
              0.2500000000000018,
              0.2500000000000018,
              0.3500000000000014,
              0.3500000000000014,
              0.45000000000000195,
              0.45000000000000195,
              0.45000000000000195,
              0.5500000000000016,
              0.5500000000000016,
              0.6500000000000012,
              0.6500000000000012,
              0.7500000000000018,
              0.7500000000000018,
              0.7500000000000018,
              0.8500000000000014,
              0.8500000000000014,
              0.9500000000000011,
              0.9500000000000011,
              0.9500000000000011,
              1.0500000000000016,
              1.0500000000000016,
              1.1500000000000012,
              1.1500000000000012,
              1.2500000000000009,
              1.2500000000000009,
              1.2500000000000009,
              1.3500000000000014,
              1.3500000000000014,
              1.450000000000001,
              1.450000000000001,
              1.5500000000000016,
              1.5500000000000016,
              1.5500000000000016,
              1.6500000000000012,
              1.6500000000000012,
              1.7500000000000009,
              1.7500000000000009,
              1.7500000000000009,
              1.8500000000000014,
              1.8500000000000014,
              1.950000000000001,
              1.950000000000001,
              2.0500000000000007,
              2.950000000000001,
              2.950000000000001,
              3.0500000000000007,
              3.0500000000000007,
              3.1500000000000004,
              3.1500000000000004,
              3.1500000000000004,
              3.250000000000001,
              3.250000000000001,
              3.3500000000000005,
              3.3500000000000005,
              3.3500000000000005,
              3.45,
              3.45,
              3.5500000000000007,
              3.5500000000000007,
              3.6500000000000004,
              3.6500000000000004,
              3.6500000000000004,
              3.75,
              3.75,
              3.8500000000000005,
              3.8500000000000005,
              3.8500000000000005,
              3.95,
              3.95,
              4.050000000000001,
              4.050000000000001,
              4.15,
              4.15,
              4.15,
              4.25,
              4.25,
              4.35,
              4.35,
              4.45,
              4.45,
              4.45,
              4.550000000000001,
              4.550000000000001,
              4.65,
              4.65,
              4.65,
              4.75,
              4.75,
              4.85,
              4.85,
              4.95,
              4.95,
              4.95
            ]
          },
          "id": "response-segment-1",
          "label": "response",
          "style": {
            "color": "#cc2244",
            "line_style": "solid",
            "line_width_pt": 1.6
          },
          "type": "line"
        }
      ],
      "representation": "semantic_vector",
      "source_strategy": "digitized_raster"
    }
  ],
  "schema": "scientificfigure.visualspec.v2",
  "theme": {
    "font": {
      "family_candidates": [
        "Arial",
        "Liberation Sans",
        "DejaVu Sans"
      ],
      "size_pt": 8
    }
  }
}
